name,menu_item,notes,email
Zowie Gutierrez, Burger, Extra cheese, zowie144grace@gmail.com
Angi Balderrama, Pork ribs, None, angie_bl64@hotmail.com
Ana Valdez, Chicken, Without French fries,anavaldez@hotmail.com
Naty Fernandez, Lasaña, None, naty45lia@gmail.com
Marcos Gutierrez, Chicken, With an extra portion of french fries, marc_gus@gmail.com
Lili Chambi, Burger, Extra cheese, lil888ana@gmail.com
Brian Torrez, Pork ribs,None,brian55torrez@gmail.com
Cecilia Belmonte, Chicken, With an extra portion of french fries,ceci_44tapia@gmail.com
Pedro Aliaga, Chicken, None, pitt78700@hotmail.com
Santiago Alarcon, Chicken, None, santi77_1880@gmail.com
Luisa Velasquez, Pork ribs,None,velasquez_luisa@gmail.com
Lidia Valdez,Pizza,None,lidy_carrasco@gmail.com
Guido Apaza,Pizza,None,gapaza45_1997@gmail.com
Ximena Callapa,Hot dog, double sausage,ximec@gmail.com
Laura Aguirre,Hot dog, None, lau_yesica@gmail.com
Freddy Huanca,Hot dog, None, hfreddy@gmail.com
Teresa Duran,Pizza,None,tereduran55@gmail.com
Alex Santiago,Hot dog,Without ketchup,lex_santi45@gmail.com
Gabi,Burguer,None,hans.andrade@sbssecurity.io
Dennis Saravia,Lasagna,None,dennis_saravia77@gmail.com
Fabian Camacho,Lasagna,Without bread,camacho_fab@gmail.com
Boris,Pork ribs,,hans.andrade@sbssecurity.io
sa,Lasagna,,asd@gmail.com
